{
  "$schema": "../../schemas/catalog-metadata.v1.schema.json",
  "schemaVersion": 1,
  "identity": {
    "kind": "skill",
    "id": "presentation-forge"
  },
  "presentation": {
    "defaultLocale": "en-US",
    "i18n": {
      "zh-CN": {
        "name": "Presentation Forge",
        "summary": "中文 toB 商业汇报 PPT 工作流：整页生图、图片页重建为可编辑 PPTX/SVG、原生模板填充，适配 Codex/Claude Code",
        "description": "面向中文 toB 商业汇报的 PPT 工作流，支持整页生图、把截图或图片型幻灯片重建为可编辑 PPTX/SVG，或用原生 PPTX 模板直接填充新内容。制作售前方案、项目汇报、产品介绍、行业分析、培训材料，或图片页转可编辑 PowerPoint 时使用。"
      },
      "en-US": {
        "name": "Presentation Forge",
        "summary": "Chinese toB business-presentation workflow — image decks, rebuild slides into editable PPTX/SVG, native template filling",
        "description": "Chinese toB business-presentation workflow: full-page image decks, rebuilding image/screenshot slides into editable PPTX/SVG, and native PPTX template filling. Use for pre-sales decks, project reports, product intros, industry analysis, training material, or image-to-editable PowerPoint. The skill body is authored in Chinese, so the en-US locale intentionally falls back to the shared body and is locked as human-maintained."
      }
    },
    "category": "creative",
    "tags": [
      "ppt",
      "pptx",
      "svg",
      "presentation",
      "slides"
    ]
  },
  "release": {
    "state": "known",
    "version": "0.1.1",
    "versionScheme": "semver"
  },
  "timestamps": {
    "catalogUpdatedAt": {
      "state": "known",
      "value": "2026-10-14",
      "precision": "day"
    },
    "releasePublishedAt": {
      "state": "unknown"
    },
    "reviewedAt": {
      "state": "unknown"
    },
    "upstreamObservedAt": {
      "state": "known",
      "value": "2026-08-10T13:30:00Z",
      "precision": "second"
    }
  },
  "provenance": {
    "content": {
      "kind": "git",
      "url": "https://github.com/mashagua/presentation-forge.git",
      "ref": "3c8e6ffa5fa97d0c14c6af8fec4beb440802b9a0"
    }
  },
  "governance": {
    "stewardship": "community",
    "availability": "installable",
    "license": {
      "state": "known",
      "value": "MIT",
      "evidencePath": "LICENSE"
    },
    "redistribution": "allowed",
    "listingMaintainer": {
      "name": "Ronnie2025",
      "verified": false
    },
    "upstreamMaintainer": {
      "name": "Ronnie2025",
      "verified": false
    }
  },
  "compatibility": {
    "platforms": {
      "state": "unknown"
    }
  },
  "spec": {
    "kind": "skill",
    "riskLevel": "low",
    "skillType": "procedural"
  }
}
