{
  "$schema": "../../schemas/catalog-metadata.v1.schema.json",
  "schemaVersion": 1,
  "identity": {
    "kind": "skill",
    "id": "canvas-design"
  },
  "presentation": {
    "defaultLocale": "en-US",
    "i18n": {
      "en-US": {
        "name": "Canvas Design",
        "summary": "Write a design philosophy first, then paint a museum-quality poster. Needs an environment that can draw and export PDF or PNG."
      },
      "zh-CN": {
        "name": "艺术画布设计",
        "summary": "先写设计哲学，再绘制博物馆级海报。需能绘制并导出 PDF/PNG 的环境。"
      }
    },
    "category": "design",
    "tags": [
      "design",
      "poster",
      "pdf",
      "art"
    ]
  },
  "release": {
    "state": "unknown"
  },
  "timestamps": {
    "catalogUpdatedAt": {
      "state": "known",
      "value": "2026-10-05T08:00:00Z",
      "precision": "second"
    },
    "releasePublishedAt": {
      "state": "unknown"
    },
    "reviewedAt": {
      "state": "known",
      "value": "2026-10-05",
      "precision": "day"
    },
    "upstreamObservedAt": {
      "state": "known",
      "value": "2026-09-29T02:20:03Z",
      "precision": "second"
    }
  },
  "provenance": {
    "content": {
      "kind": "git",
      "url": "https://github.com/anthropics/skills.git",
      "path": "skills/canvas-design",
      "ref": "8a1541c4a3ffa5a20a5a91de0dcf3f0bab1d1ef4"
    }
  },
  "governance": {
    "stewardship": "community",
    "availability": "installable",
    "license": {
      "state": "known",
      "value": "Apache-2.0",
      "evidencePath": "skills/canvas-design/LICENSE.txt"
    },
    "redistribution": "allowed",
    "upstreamMaintainer": {
      "name": "anthropics",
      "url": "https://github.com/anthropics/skills",
      "verified": false
    },
    "compliance": {
      "licenseEvidencePath": "skills/canvas-design/LICENSE.txt",
      "reviewedRef": "8a1541c4a3ffa5a20a5a91de0dcf3f0bab1d1ef4",
      "reviewedAt": "2026-10-05",
      "reviewedBy": "mashagua",
      "upstreamEndorsed": false
    }
  },
  "compatibility": {
    "platforms": {
      "state": "unknown"
    }
  },
  "spec": {
    "kind": "skill"
  }
}
