{
  "$schema": "../../schemas/catalog-metadata.v1.schema.json",
  "schemaVersion": 1,
  "identity": {
    "kind": "skill",
    "id": "apple-notes"
  },
  "presentation": {
    "defaultLocale": "en-US",
    "i18n": {
      "en-US": {
        "name": "Apple Notes",
        "summary": "Create, search and edit macOS Notes from the terminal. macOS only; requires Homebrew memo and Automation permission for Notes."
      },
      "zh-CN": {
        "name": "Apple 备忘录",
        "summary": "在终端里增删查改 macOS 备忘录。仅限 macOS；需 Homebrew 安装 memo，并授予备忘录自动化权限。"
      }
    },
    "category": "productivity",
    "tags": [
      "apple",
      "notes",
      "macos",
      "cli"
    ]
  },
  "release": {
    "state": "unknown"
  },
  "timestamps": {
    "catalogUpdatedAt": {
      "state": "known",
      "value": "2026-10-05T08:00:00Z",
      "precision": "second"
    },
    "releasePublishedAt": {
      "state": "unknown"
    },
    "reviewedAt": {
      "state": "known",
      "value": "2026-10-05",
      "precision": "day"
    },
    "upstreamObservedAt": {
      "state": "known",
      "value": "2026-10-05T10:21:49Z",
      "precision": "second"
    }
  },
  "provenance": {
    "content": {
      "kind": "git",
      "url": "https://github.com/openclaw/openclaw.git",
      "path": "skills/apple-notes",
      "ref": "6ddf5a6106c18c4cf803a601b3a099e497d943fb"
    }
  },
  "governance": {
    "stewardship": "community",
    "availability": "installable",
    "license": {
      "state": "known",
      "value": "MIT",
      "evidencePath": "LICENSE"
    },
    "redistribution": "allowed",
    "upstreamMaintainer": {
      "name": "openclaw",
      "url": "https://github.com/openclaw/openclaw",
      "verified": false
    },
    "compliance": {
      "licenseEvidencePath": "LICENSE",
      "reviewedRef": "6ddf5a6106c18c4cf803a601b3a099e497d943fb",
      "reviewedAt": "2026-10-05",
      "reviewedBy": "mashagua",
      "upstreamEndorsed": false
    }
  },
  "compatibility": {
    "platforms": {
      "state": "unknown"
    }
  },
  "spec": {
    "kind": "skill"
  }
}
