{
  "$schema": "../../schemas/catalog-metadata.v1.schema.json",
  "schemaVersion": 1,
  "identity": {
    "kind": "skill",
    "id": "agent-reach"
  },
  "presentation": {
    "defaultLocale": "en-US",
    "i18n": {
      "en-US": {
        "name": "Agent Reach",
        "summary": "Web research and social search across Xiaohongshu, X/Twitter, Bilibili, Reddit, YouTube and more. Install Agent Reach and required third-party CLIs separately, and authorize the relevant platform accounts."
      },
      "zh-CN": {
        "name": "Agent Reach",
        "summary": "全网调研与社媒搜索：覆盖小红书、X/Twitter、B 站、Reddit、YouTube 等平台的内容检索与信息聚合。需自行安装 Agent Reach 及所需第三方 CLI，并授权对应平台账号。"
      }
    },
    "category": "research",
    "tags": [
      "research",
      "web-search",
      "social-media",
      "twitter",
      "reddit",
      "youtube",
      "bilibili",
      "xiaohongshu"
    ]
  },
  "release": {
    "state": "unknown"
  },
  "timestamps": {
    "catalogUpdatedAt": {
      "state": "known",
      "value": "2026-10-19",
      "precision": "day"
    },
    "releasePublishedAt": {
      "state": "unknown"
    },
    "reviewedAt": {
      "state": "known",
      "value": "2026-10-19",
      "precision": "day"
    },
    "upstreamObservedAt": {
      "state": "known",
      "value": "2026-10-19",
      "precision": "day"
    }
  },
  "provenance": {
    "content": {
      "kind": "git",
      "url": "https://github.com/Panniantong/agent-reach.git",
      "path": "agent_reach/skill",
      "ref": "94f06c1969dfc1834001269d79d3ad0972d9dee6"
    }
  },
  "governance": {
    "stewardship": "community",
    "availability": "listing-only",
    "license": {
      "state": "known",
      "value": "MIT",
      "evidencePath": "LICENSE"
    },
    "redistribution": "allowed",
    "upstreamMaintainer": {
      "name": "Panniantong",
      "url": "https://github.com/Panniantong/agent-reach",
      "verified": false
    }
  },
  "compatibility": {
    "platforms": {
      "state": "unknown"
    },
    "requirements": [
      {
        "kind": "runtime",
        "value": "User-installed Agent Reach and the platform CLIs required by the chosen channel. Browser-based channels require a user-controlled browser session; no fixed conda environment is assumed."
      },
      {
        "kind": "permission",
        "value": "The operator authorizes platform accounts and any cookie or browser-session access. Platform restrictions and optional service costs apply separately; stop when authorization or a channel is unavailable."
      }
    ]
  },
  "spec": {
    "kind": "skill"
  }
}
